{
  "run_id": "normal",
  "model": "load_v3",
  "model_version": "2026-09-24",
  "dt_id": "DT-0417",
  "phase": "R",
  "interval_end": "2026-09-25T13:45:00Z",
  "run_time": "2026-09-24T14:00:00Z",
  "p10_kw": 18.2,
  "p50_kw": 22.7,
  "p90_kw": 27.9,
  "inputs_as_of": {
    "meter_data": "2026-09-23",
    "weather_run": "2026-09-24T06:00:00Z"
  }
}
